{
  "name": "motoriste",
  "matchUpperCase": true,
  "matchLowerCase": false,
  "cases": {
    "1": {
      "matches": [
        "Motoristé sobě",
        "Motoristé"
      ],
      "replacements": [
        "Motoristé v sobě",
        "Šalinisté sobě",
        "Močůristé",
        "Motopedisté",
        "Vejfukáři"
      ]
    },
    "2": {
      "matches": [
        "Motoristů sobě",
        "Motoristů"
      ],
      "replacements": [
        "Motoristů v sobě",
        "Šalinistů sobě",
        "Močůristů",
        "Motopedistů",
        "Vejfukářů"
      ]
    },
    "3": {
      "matches": [
        "Motoristům sobě",
        "Motoristům"
      ],
      "replacements": [
        "Motoristům v sobě",
        "Šalinistům sobě",
        "Močůristům",
        "Motopedistům",
        "Vejfukářům"
      ]
    },
    "4": {
      "matches": [
        "Motoristy sobě",
        "Motoristy"
      ],
      "replacements": [
        "Motoristy v sobě",
        "Šalinisty sobě",
        "Močůristy",
        "Motopedisty",
        "Vejfukáře"
      ]
    },
    "5": {
      "matches": [
        "Motoristé sobě",
        "Motoristé"
      ],
      "replacements": [
        "Motoristé v sobě",
        "Šalinisté sobě",
        "Močůristé",
        "Motopedisté",
        "Vejfukáři"
      ]
    },
    "6": {
      "matches": [
        "Motoristech sobě",
        "Motoristech"
      ],
      "replacements": [
        "Motoristech v sobě",
        "Šalinistech sobě",
        "Močůristech",
        "Motopedistech",
        "Vejfukářích"
      ]
    },
    "7": {
      "matches": [
        "Motoristy sobě",
        "Motoristy"
      ],
      "replacements": [
        "Motoristy v sobě",
        "Šalinisty sobě",
        "Močůristy",
        "Motopedisty",
        "Vejfukáři"
      ]
    }
  }
}