{
  "name": "vavra",
  "matchUpperCase": true,
  "matchLowerCase": true,
  "cases": {
    "1": {
      "matches": [
        "Vávra",
        "Daniel Vávra"
      ],
      "replacements": [
        "CEO sebereflexe",
        "Gibon v Bentley",
        "Frý Spíč Mafia",
        "Ban Vávra"
      ]
    },
    "2": {
      "matches": [
        "Vávry",
        "Daniela Vávry"
      ],
      "replacements": [
        "CEO sebereflexe",
        "Gibona v Bentley",
        "Frý Spíč Mafie",
        "Bana Vávry"
      ]
    },
    "3": {
      "matches": [
        "Vávrovi",
        "Danielu Vávrovi"
      ],
      "replacements": [
        "CEO sebereflexe",
        "Gibonovi v Bentley",
        "Frý Spíč Mafii",
        "Banu Vávrovi"
      ]
    },
    "4": {
      "matches": [
        "Vávru",
        "Daniela Vávru"
      ],
      "replacements": [
        "CEO sebereflexe",
        "Gibona v Bentley",
        "Frý Spíč Mafii",
        "Bana Vávru"
      ]
    },
    "5": {
      "matches": [
        "Vávro",
        "Danieli Vávro"
      ],
      "replacements": [
        "CEO sebereflexe",
        "Gibone v Bentley",
        "Frý Spíč Mafie",
        "Bane Vávro"
      ]
    },
    "6": {
      "matches": [
        "Vávrovi",
        "Danielu Vávrovi"
      ],
      "replacements": [
        "CEO sebereflexe",
        "Gibonovi v Bentley",
        "Frý Spíč Mafii",
        "Banu Vávrovi"
      ]
    },
    "7": {
      "matches": [
        "Vávrou",
        "Danielem Vávrou"
      ],
      "replacements": [
        "CEO sebereflexe",
        "Gibonem v Bentley",
        "Frý Spíč Mafií",
        "Banem Vávrou"
      ]
    }
  }
}