{
  "name": "trump",
  "matchUpperCase": true,
  "matchLowerCase": true,
  "cases": {
    "1": {
      "matches": [
        "Trump",
        "Donald Trump"
      ],
      "replacements": [
        "Oranžgutan",
        "Oranžový tlučhuba",
        "Nejlepší ruský prezident",
        "Alzhajmrista",
        "Bombarduju, nebombarduju, bombarduju...",
        "Ředitel Zeměkoule",
        "Ochmatávač holčiček",
        "Ochmatávač Billa",
        "Donica Lewinsky",
        "No more wars",
        "Velký a krásný stratég",
        "Mírokurvce",
        "peDonald",
        "Agent Krasnov",
        "Cvičný terč",
        "Don Tzu",
        "Art of the Diesel"
      ]
    },
    "2": {
      "matches": [
        "Trumpa",
        "Donalda Trumpa"
      ],
      "replacements": [
        "Oranžgutana",
        "Oranžového tlučhuby",
        "Nejlepšího ruského prezidenta",
        "Alzhajmristy",
        "Bombarduju, nebombarduju, bombarduju...",
        "Ředitele Zeměkoule",
        "Ochmatávače holčiček",
        "Ochmatávače Billa",
        "Donicy Lewinsky",
        "No more wars",
        "Velkého a krásného stratéga",
        "Mírokurvce",
        "peDonalda",
        "Agenta Krasnova",
        "Cvičného terče",
        "Dona Tzu",
        "Art of the Diesela"
      ]
    },
    "3": {
      "matches": [
        "Trumpovi",
        "Donaldu Trumpovi"
      ],
      "replacements": [
        "Oranžgutanovi",
        "Oranžovému tlučhubovi",
        "Nejlepšímu ruskému prezidentovi",
        "Alzhajmristovi",
        "Bombarduju, nebombarduju, bombarduju...",
        "Řediteli Zeměkoule",
        "Ochmatávači holčiček",
        "Ochmatávači Billa",
        "Donice Lewinsky",
        "No more wars",
        "Velkému a krásnému stratégovi",
        "Mírokurvcovi",
        "peDonaldovi",
        "Agentu Krasnovovi",
        "Cvičnému terči",
        "Donu Tzu",
        "Art of the Dieselovi"
      ]
    },
    "4": {
      "matches": [
        "Trumpa",
        "Donalda Trumpa"
      ],
      "replacements": [
        "Oranžgutana",
        "Oranžového tlučhubu",
        "Nejlepšího ruského prezidenta",
        "Alzhajmristu",
        "Bombarduju, nebombarduju, bombarduju...",
        "Ředitele Zeměkoule",
        "Ochmatávače holčiček",
        "Ochmatávače Billa",
        "Donicu Lewinsky",
        "No more wars",
        "Velkého a krásného stratéga",
        "Mírokurvce",
        "peDonalda",
        "Agenta Krasnova",
        "Cvičný terč",
        "Dona Tzu",
        "Art of the Diesela"
      ]
    },
    "5": {
      "matches": [
        "Trumpe",
        "Donalde Trumpe"
      ],
      "replacements": [
        "Oranžgutane",
        "Oranžový tlučhubo",
        "Nejlepší ruský prezidente",
        "Alzhajmristo",
        "Bombarduju, nebombarduju, bombarduju...",
        "Řediteli Zeměkoule",
        "Ochmatávači holčiček",
        "Ochmatávači Billa",
        "Donico Lewinsky",
        "No more wars",
        "Velký a krásný stratégu",
        "Mírokurvce",
        "peDonalde",
        "Agente Krasnove",
        "Cvičný terči",
        "Done Tzu",
        "Art of the Diesele"
      ]
    },
    "6": {
      "matches": [
        "Trumpovi",
        "Donaldu Trumpovi"
      ],
      "replacements": [
        "Oranžgutanovi",
        "Oranžovém tlučhubovi",
        "Nejlepším ruském prezidentovi",
        "Alzhajmristovi",
        "Bombarduju, nebombarduju, bombarduju...",
        "Řediteli Zeměkoule",
        "Ochmatávači holčiček",
        "Ochmatávači Billa",
        "Donice Lewinsky",
        "No more wars",
        "Velkém a krásném stratégovi",
        "Mírokurvcovi",
        "peDonaldovi",
        "Agentu Krasnovovi",
        "Cvičném terči",
        "Donu Tzu",
        "Art of the Dieselovi"
      ]
    },
    "7": {
      "matches": [
        "Trumpem",
        "Donaldem Trumpem"
      ],
      "replacements": [
        "Oranžgutanem",
        "Oranžovým tlučhubou",
        "Nejlepším ruským prezidentem",
        "Alzhajmristou",
        "Bombarduju, nebombarduju, bombarduju...",
        "Ředitelem Zeměkoule",
        "Ochmatávačem holčiček",
        "Ochmatávačem Billa",
        "Donicou Lewinsky",
        "No more wars",
        "Velkým a krásným stratégem",
        "Mírokurvcem",
        "peDonaldem",
        "Agentem Krasnovem",
        "Cvičným terčem",
        "Donem Tzu",
        "Art of the Dieselem"
      ]
    }
  },
  "adjectives": {
    "to": {
      "matches": [
        "Trumpovo"
      ],
      "replacements": [
        "Alzhajmristovo",
        "Krasnovovo",
        "peDonaldovo",
        "Mírokurvcovo",
        "Don Tzuovo",
        "Art of the Dieselovo"
      ]
    },
    "ta": {
      "matches": [
        "Trumpova"
      ],
      "replacements": [
        "Alzhajmristova",
        "Krasnovova",
        "peDonaldova",
        "Mírokurvcova",
        "Don Tzuova",
        "Art of the Dieselova"
      ]
    },
    "ten": {
      "matches": [
        "Trumpův"
      ],
      "replacements": [
        "Alzhajmristův",
        "Krasnovův",
        "peDonaldův",
        "Mírokurvcův",
        "Don Tzuův",
        "Art of the Dieselův"
      ]
    },
    "ti": {
      "matches": [
        "Trumpovi"
      ],
      "replacements": [
        "Alzhajmristovi",
        "Krasnovovi",
        "peDonaldovi",
        "Mírokurvcovi",
        "Don Tzuovi",
        "Art of the Dieselovi"
      ]
    },
    "ty": {
      "matches": [
        "Trumpovy"
      ],
      "replacements": [
        "Alzhajmristovy",
        "Krasnovovy",
        "peDonaldovy",
        "Mírokurvcovy",
        "Don Tzuovy",
        "Art of the Dieselovy"
      ]
    },
    "te": {
      "matches": [
        "Trumpově"
      ],
      "replacements": [
        "Alzhajmristově",
        "Krasnovově",
        "peDonaldově",
        "Mírokurvcově",
        "Don Tzuově",
        "Art of the Dieselově"
      ]
    },
    "tu": {
      "matches": [
        "Trumpovu"
      ],
      "replacements": [
        "Alzhajmristovu",
        "Krasnovovu",
        "peDonaldovu",
        "Mírokurvcovu",
        "Don Tzuovu",
        "Art of the Dieselovu"
      ]
    },
    "tou": {
      "matches": [
        "Trumpovou"
      ],
      "replacements": [
        "Alzhajmristovou",
        "Krasnovovou",
        "peDonaldovou",
        "Mírokurvcovou",
        "Don Tzuovou",
        "Art of the Dieselovou"
      ]
    },
    "tim": {
      "matches": [
        "Trumpovým"
      ],
      "replacements": [
        "Alzhajmristovým",
        "Krasnovovým",
        "peDonaldovým",
        "Mírokurvcovým",
        "Don Tzuovým",
        "Art of the Dieselovým"
      ]
    },
    "tech": {
      "matches": [
        "Trumpových"
      ],
      "replacements": [
        "Alzhajmristových",
        "Krasnovových",
        "peDonaldových",
        "Mírokurvcových",
        "Don Tzuových",
        "Art of the Dieselových"
      ]
    },
    "temi": {
      "matches": [
        "Trumpovými"
      ],
      "replacements": [
        "Alzhajmristovými",
        "Krasnovovými",
        "peDonaldovými",
        "Mírokurvcovými",
        "Don Tzuovými",
        "Art of the Dieselovými"
      ]
    }
  }
}