{
  "name": "rajchl",
  "matchUpperCase": true,
  "matchLowerCase": true,
  "cases": {
    "1": {
      "matches": [
        "Rajchl",
        "Jindřich Rajchl"
      ],
      "replacements": [
        "Pornoherec",
        "Bezzubý prostitut",
        "Předseda PoRnO",
        "JáJsemPrávník",
        "Jindřich Štrajchl"
      ]
    },
    "2": {
      "matches": [
        "Rajchla",
        "Jindřicha Rajchla"
      ],
      "replacements": [
        "Pornoherce",
        "Bezzubého prostituta",
        "Předsedy PoRnO",
        "JáJsemPrávníka",
        "Jindřicha Štrajchla"
      ]
    },
    "3": {
      "matches": [
        "Rajchlovi",
        "Jindřichu Rajchlovi"
      ],
      "replacements": [
        "Pornoherci",
        "Bezzubému prostitutovi",
        "Předsedovi PoRnO",
        "JáJsemPrávníkovi",
        "Jindřichu Štrajchlovi"
      ]
    },
    "4": {
      "matches": [
        "Rajchla",
        "Jindřicha Rajchla"
      ],
      "replacements": [
        "Pornoherce",
        "Bezzubého prostituta",
        "Předsedu PoRnO",
        "JáJsemPrávníka",
        "Jindřicha Štrajchla"
      ]
    },
    "5": {
      "matches": [
        "Rajchle",
        "Jindřichu Rajchle"
      ],
      "replacements": [
        "Pornoherče",
        "Bezzubý prostitute",
        "Předsedo PoRnO",
        "JáJsemPrávníku",
        "Jindřichu Štrajchle"
      ]
    },
    "6": {
      "matches": [
        "Rajchlovi",
        "Jindřichu Rajchlovi"
      ],
      "replacements": [
        "Pornoherci",
        "Bezzubém prostitutovi",
        "Předsedovi PoRnO",
        "JáJsemPrávníkovi",
        "Jindřichu Štrajchlovi"
      ]
    },
    "7": {
      "matches": [
        "Rajchlem",
        "Jindřichem Rajchlem"
      ],
      "replacements": [
        "Pornohercem",
        "Bezzubým prostitutem",
        "Předsedou PoRnO",
        "JáJsemPrávníkem",
        "Jindřichem Štrajchlem"
      ]
    }
  },
  "adjectives": {
    "to": {
      "matches": [
        "Rajchlovo"
      ],
      "replacements": [
        "Pornohercovo",
        "Štrajchlovo"
      ]
    },
    "ta": {
      "matches": [
        "Rajchlova"
      ],
      "replacements": [
        "Pornohercova",
        "Štrajchlova"
      ]
    },
    "ten": {
      "matches": [
        "Rajchlův"
      ],
      "replacements": [
        "Pornohercův",
        "Štrajchlův"
      ]
    },
    "ti": {
      "matches": [
        "Rajchlovi"
      ],
      "replacements": [
        "Pornohercovi",
        "Štrajchlovi"
      ]
    },
    "ty": {
      "matches": [
        "Rajchlovy"
      ],
      "replacements": [
        "Pornohercovy",
        "Štrajchlovy"
      ]
    },
    "te": {
      "matches": [
        "Rajchlově"
      ],
      "replacements": [
        "Pornohercově",
        "Štrajchlově"
      ]
    },
    "tu": {
      "matches": [
        "Rajchlovu"
      ],
      "replacements": [
        "Pornohercovu",
        "Štrajchlovu"
      ]
    },
    "tou": {
      "matches": [
        "Rajchlovou"
      ],
      "replacements": [
        "Pornohercovou",
        "Štrajchlovou"
      ]
    },
    "tim": {
      "matches": [
        "Rajchlovým"
      ],
      "replacements": [
        "Pornohercovým",
        "Štrajchlovým"
      ]
    },
    "tech": {
      "matches": [
        "Rajchlových"
      ],
      "replacements": [
        "Pornohercových",
        "Štrajchlových"
      ]
    },
    "temi": {
      "matches": [
        "Rajchlovými"
      ],
      "replacements": [
        "Pornohercovými",
        "Štrajchlovými"
      ]
    }
  }
}