{
  "name": "stastny",
  "matchUpperCase": true,
  "matchLowerCase": true,
  "cases": {
    "1": {
      "matches": [
        "Boris Šťastný",
        "Šťastný"
      ],
      "replacements": [
        "Ministr kotrmelců",
        "S ministerstvem Šťastný",
        "Ve výtahu Nešťastný",
        "Bez dotací pro Strážnici Šťastný",
        "Plukovník Schod",
        "Bez záznamníku Nešťastný"
      ]
    },
    "2": {
      "matches": [
        "Borise Šťastného",
        "Šťastného"
      ],
      "replacements": [
        "Ministra kotrmelců",
        "S ministerstvem Šťastného",
        "Ve výtahu Nešťastného",
        "Bez dotací pro Strážnici Šťastného",
        "Plukovníka Schoda",
        "Bez záznamníku Nešťastného"
      ]
    },
    "3": {
      "matches": [
        "Borisi Šťastnému",
        "Šťastnému"
      ],
      "replacements": [
        "Ministrovi kotrmelců",
        "S ministerstvem Šťastnému",
        "Ve výtahu Nešťastnému",
        "Bez dotací pro Strážnici Šťastnému",
        "Plukovníku Schodovi",
        "Bez záznamníku Nešťastnému"
      ]
    },
    "4": {
      "matches": [
        "Borise Šťastného",
        "Šťastného"
      ],
      "replacements": [
        "Ministra kotrmelců",
        "s ministerstvem Šťastného",
        "Ve výtahu neŠťastného",
        "Bez dotací pro Strážnici Šťastného",
        "Plukovníka Schoda",
        "Bez záznamníku Nešťastného"
      ]
    },
    "5": {
      "matches": [
        "Borisi Šťastný",
        "Šťastný"
      ],
      "replacements": [
        "Ministře kotrmelců",
        "s ministerstvem Šťastný",
        "Ve výtahu neŠťastný",
        "Bez dotací pro Strážnici Šťastný",
        "Plukovníku Schode",
        "Bez záznamníku Nešťastný"
      ]
    },
    "6": {
      "matches": [
        "Borisi Šťastném",
        "Šťastném"
      ],
      "replacements": [
        "Ministrovi kotrmelců",
        "s ministerstvem Šťastném",
        "Ve výtahu neŠťastném",
        "Bez dotací pro Strážnici Šťastném",
        "Plukovníku Schodovi",
        "Bez záznamníku Nešťastném"
      ]
    },
    "7": {
      "matches": [
        "Borisem Šťastným",
        "Šťastným"
      ],
      "replacements": [
        "Ministrem kotrmelců",
        "s ministerstvem Šťastným",
        "Ve výtahu neŠťastným",
        "Bez dotací pro Strážnici Šťastným",
        "Plukovníkem Schodem",
        "Bez záznamníku Nešťastným"
      ]
    }
  }
}